{
  "$schema": "https://json-schema.org/draft/2020-12/schema",
  "$id": "https://melsovcozy.github.io/vetkit/schemas/lock.schema.json",
  "title": "Lock",
  "type": "object",
  "$defs": {
    "LockModel": {
      "title": "LockModel",
      "type": "object",
      "properties": {
        "requested": { "type": "string" },
        "resolved": { "type": "string" },
        "transport": { "type": "string" },
        "pinned": { "type": "boolean" },
        "releaseDate": { "type": "string" }
      },
      "required": ["requested", "resolved", "transport", "pinned"],
      "additionalProperties": false
    },
    "GauntletOutcome": {
      "title": "GauntletOutcome",
      "enum": ["pass", "fail", "skipped"]
    },
    "GauntletDetail": {
      "title": "GauntletDetail",
      "type": "object",
      "properties": {
        "masterKeyReason": { "enum": ["no_escape"] },
        "masterKeyFailed": {
          "type": "array",
          "items": {
            "type": "object",
            "properties": {
              "kind": { "type": "string" },
              "caseId": { "type": "string" }
            },
            "required": ["kind", "caseId"],
            "additionalProperties": false
          }
        },
        "injectionFlips": {
          "type": "array",
          "items": {
            "type": "object",
            "properties": {
              "family": { "type": "string" },
              "flips": { "type": "integer", "minimum": 0 },
              "labelFlips": { "type": "integer", "minimum": 0 },
              "trials": { "type": "integer", "minimum": 0 }
            },
            "required": ["family", "flips", "labelFlips", "trials"],
            "additionalProperties": false
          }
        }
      },
      "additionalProperties": false
    },
    "GauntletResult": {
      "title": "GauntletResult",
      "type": "object",
      "properties": {
        "paraphrase": { "$ref": "#/$defs/GauntletOutcome" },
        "polarity": { "$ref": "#/$defs/GauntletOutcome" },
        "injection": { "$ref": "#/$defs/GauntletOutcome" },
        "master_key": { "$ref": "#/$defs/GauntletOutcome" },
        "label_permutation": { "$ref": "#/$defs/GauntletOutcome" },
        "constant_output": { "$ref": "#/$defs/GauntletOutcome" },
        "position_swap": { "$ref": "#/$defs/GauntletOutcome" },
        "length": { "$ref": "#/$defs/GauntletOutcome" }
      },
      "required": [
        "paraphrase",
        "polarity",
        "injection",
        "master_key",
        "label_permutation",
        "constant_output",
        "position_swap",
        "length"
      ],
      "additionalProperties": false
    },
    "LockReason": {
      "title": "LockReason",
      "enum": [
        "too_few_labels",
        "single_class",
        "single_class_heldout",
        "class_too_small",
        "unstable",
        "too_few_repeats",
        "language_limited",
        "score_not_gateable",
        "reference_missing",
        "judge_unavailable",
        "paraphrase",
        "polarity",
        "injection",
        "master_key",
        "label_permutation",
        "constant_output",
        "position_swap",
        "length"
      ]
    },
    "LockCriterion": {
      "title": "LockCriterion",
      "type": "object",
      "properties": {
        "wordingHash": { "type": "string", "pattern": "^[0-9a-f]{64}$" },
        "normalizedWordingHash": { "type": "string", "pattern": "^[0-9a-f]{64}$" },
        "status": { "enum": ["calibrated", "uncalibrated", "floating"] },
        "threshold": { "type": "number" },
        "tpr": { "type": "number", "minimum": 0, "maximum": 1 },
        "tnr": { "type": "number", "minimum": 0, "maximum": 1 },
        "ece": { "type": "number", "minimum": 0, "maximum": 1 },
        "tolerance": { "type": "number", "minimum": 0 },
        "gauntlet": { "$ref": "#/$defs/GauntletResult" },
        "gauntletDetail": { "$ref": "#/$defs/GauntletDetail" },
        "reasons": { "type": "array", "items": { "$ref": "#/$defs/LockReason" } },
        "languages": { "type": "array", "items": { "type": "string" } },
        "labelCount": { "type": "integer", "minimum": 0 },
        "unscored": { "type": "integer", "minimum": 0 },
        "unscoredCauses": { "type": "array", "items": { "type": "string" } }
      },
      "required": ["wordingHash", "status", "gauntlet", "reasons", "labelCount"],
      "additionalProperties": false
    }
  },
  "properties": {
    "lockVersion": { "const": 1 },
    "model": { "$ref": "#/$defs/LockModel" },
    "criteria": {
      "type": "object",
      "additionalProperties": { "$ref": "#/$defs/LockCriterion" }
    },
    "datasetHash": { "type": "string", "pattern": "^[0-9a-f]{64}$" },
    "requestFormat": {
      "description": "Judge request format the lock was calibrated with.",
      "enum": ["raw", "fenced-v1"]
    }
  },
  "required": ["lockVersion", "model", "criteria", "datasetHash"],
  "additionalProperties": false
}
